Name ,Location,Address,email,phone,web,FB,IG,,,,,,,,
Nome Organizzazione: Canile e Gattile Regionale della Valle d'Aosta,,"Indirizzo Fisico: Località La Croix Noire, Rue de l'Arène 10, 11020 Saint-Christophe (AO)",Email: cgr.aosta@coopmelograno.org,,Sito Web: canilegattileregionale-vda.it,PEC: cgr.aosta@pec.coopmelograno.org,,,,Pagina FB: Canile e Gattile Regionale della Valle d'Aosta,,Pagina IG: Non attiva direttamente (le adozioni e gli appelli passano per la pagina FB ufficiale e tramite i canali di AVAPA).,,"Telefono: +39 366 567 4843 [1, 2]",
Nome Organizzazione: AVAPA ODV,,"Indirizzo Fisico: Località Grand Chemin 187, 11020 Saint-Christophe (AO) (dietro Cinelandia)",Email: infoavapaodv@gmail.com,,Sito Web: avapa.org,PEC: avapaodv@pec.it (estratta da registri Terzo Settore),,,,Pagina FB: AVAPA ODV,,Pagina IG: @avapa_odv,,"Telefono: +39 375 503 7842 [1, 2]",
Nome Organizzazione: Centro Recupero Animali Selvatici della Valle d'Aosta,,"Indirizzo Fisico: Località Busseyaz 56, 11020 Quart (AO)",Email: r.stella@regione.vda.it (contatto del responsabile dell'Ufficio fauna selvatica),,Sito Web: regione.vda.it - Sezione CRAS,PEC: risorse_naturali@pec.regione.vda.it (PEC dell'Assessorato regionale di competenza),,,,Pagina FB / IG: Non presenti (gestione interamente istituzionale).,,,,Telefono: +39 0165 773800,
La Zampa VdA ODV,,"Via Roma 19 aosta, Aosta, Italy, 11100",lazampavda@gmail.com,,,,,,,https://www.facebook.com/p/La-Zampa-VdA-ODV-61559279334549/,,,,,
L' Albero di Mais,,"C.so Savona, 140, 10024 Moncalieri TO",amici.canilemoncalieri@gmail.com,,https://alberodimais.it/,,,,,,,,,011 640 9398,
Arca di Piera,,"Via Valgioie 39, Rivalta di Torino, Torino, Piemonte, 10040",arcadipieraposta@gmail.com,,https://www.arcadipiera.it/,,,,,,,,,FRANCA Tel. 335-421007,CLAUDIA Tel. 338-3837404
Protezione Micio,,c.so Peschiera 325 – Torino,Info@protezionemicio.it,,https://www.protezionemicio.it/,,,,,,,,,,
LA GATTERIA!,,,,,,,,,,https://www.facebook.com/lagatteria/about?locale=it_IT,,,,,